<?xml version="1.0" encoding="ISO-8859-1"?>
<!DOCTYPE quicksec PUBLIC "quicksec:dtd" "quicksec.dtd">


<!-- Nested tunnel setup, tunnel hosta-hostc is sent through a 
     tunnel hosta-hostb. 
     hosta = hostb - hostc -->
<!-- Related: hosta-nested.xml, hostc-nested.xml -->
<quicksec>
  <params>
    <!-- Authentication domain specifies IKE authentication
         parameters -->
    <auth-domain>
      <!-- shared secret and identity of remote IKE peers -->
      <remote-secret id-type="email" 
                     id="a@safenet-inc.com">foo</remote-secret>
    </auth-domain>

    <!-- Authentication domain specifies IKE authentication
         parameters -->
    <auth-domain name="auth2">
      <remote-secret id-type="email" 
                     id="c@safenet-inc.com">car</remote-secret>
    </auth-domain>
  </params>
  <policy>

    <!-- Outer ESP tunnelmode tunnel -->
    <tunnel name="outer" transform="esp aes sha1">
      <identity id-type="email" id="b@safenet-inc.com">
        <local-secret>foo</local-secret>
      </identity>
      <local-ip>172.30.4.167</local-ip>
      <peer>172.30.4.189</peer>      
    </tunnel>

    <!-- Inner ESP transportmode tunnel -->
    <tunnel name="inner" transform="esp aes sha1" flags="transport">
      <identity id-type="email" id="b@safenet-inc.com">
        <local-secret>foo</local-secret>
      </identity>
      <!-- Authentication domain used in IKE authentication -->
      <authentication auth-domain-name="auth2"/>
      <!-- Specify name of outer tunnel to use for this tunnel. -->
      <outer-tunnel name="outer"/>
    </tunnel>

    <!-- Allows plaintext packets to be tunneled to hostc using end-to-end 
         transportmode ESP nested inside tunnelmode ESP between hosta 
         and hostb. -->
    <rule to-tunnel="inner">
      <src>ipv4(172.30.4.167)</src>
      <dst>ipv4(tcp,192.168.1.2),ipv4(udp,192.168.1.2),ipv4(icmp,192.168.1.2)
      </dst>
    </rule>

    <rule from-tunnel="inner">
      <src>ipv4(tcp,192.168.1.2),ipv4(udp,192.168.1.2),ipv4(icmp,192.168.1.2)
      </src>
      <dst>ipv4(172.30.4.167)</dst>
    </rule>

    <!-- Allows plaintext packets to be tunneled to netb using 
         tunnelmode ESP. Matches also ESP + IKE packets encapsulated using 
         the inner tunnel. Flag `match-local-ike' speci fies that the rule
         overrides system default IKE passby rules. --> 
    <rule to-tunnel="outer" flags="match-local-ike">
      <dst>ipv4(192.168.1.0/24)</dst>
    </rule>

    <rule from-tunnel="outer">
      <src>ipv4(192.168.1.0/24)</src>
    </rule>

    <!-- Default passby rule. -->
    <rule/>

  </policy>
</quicksec>
