<?xml version="1.0" encoding="ISO-8859-1"?>
<!DOCTYPE quicksec PUBLIC "quicksec:dtd" "quicksec.dtd">


<!-- Remote access setup, iras acting as server and irac as client. -->
<!-- Related: hostb-cp-irac.xml -->
<quicksec>
  <params>
    <!-- IRAS gives virtual IP address from range defined 
         in address element. Subnet element defines which subnet
         is accessible through the gateway. More than one subnet
         element can be defined. -->
    <address-pool>
      <subnet>192.168.200.0/24</subnet>
      <subnet>192.168.100.0/24</subnet>
      <address netmask="255.255.255.0">192.168.200.3-192.168.200.254</address>
    </address-pool> 

    <!-- Authentication domain specifies IKE authentication
         parameters -->
    <auth-domain>
      <!-- shared secrets and identities of remote IKE peers -->
      <remote-secret id-type="email" 
                     id="b@safenet-inc.com">foo</remote-secret>
      <remote-secret id-type="email" 
                     id="c@safenet-inc.com">foobar</remote-secret>
    </auth-domain>
  </params>
  <policy>

    <tunnel name="remote-access" flags="require-cfgmode 
                                        allow-cfgmode 
                                        proxy-arp">
      <!-- local identity sent to the remote IKE peer.
           local shared secret is taken from the remote secret
           based on the remote identity, if local-secret has
           not been specified as in this example. -->
      <identity id-type="email" id="a@safenet-inc.com"/>
      <ike-versions>2</ike-versions>
    </tunnel>

    <!-- Allow traffic from the remote access clients. -->
    <rule from-tunnel="remote-access"/>

    <!-- Pass rule, that handles all traffic not matching
         to traffic selectors on any higher precedence rules.
         Remove this rule if plain text traffic is forbidden. -->
    <rule>
      <src>ipv4(0.0.0.0/0)</src>
      <dst>ipv4(0.0.0.0/0)</dst>
    </rule>

  </policy>
</quicksec>
